{
  "identity": {
    "id": "VECTOR-DATABASE-10002",
    "slug": "qdrant",
    "name": {
      "official": "Qdrant",
      "display": "Qdrant",
      "short": "Qdrant"
    },
    "entityType": "VectorDatabase",
    "aliases": [
      "Qdrant Vector Database",
      "Qdrant Vector Search Engine"
    ],
    "keywords": [
      "dedicated vector database",
      "HNSW",
      "payload filtering",
      "sparse vectors",
      "hybrid retrieval",
      "distributed vector search",
      "RAG storage"
    ],
    "taxonomy": {
      "family": "Vector Databases",
      "subFamily": "Dedicated Vector Databases",
      "category": "Vector Search Infrastructure",
      "domain": "Retrieval-Augmented Generation"
    },
    "status": "Draft",
    "visibility": "Public",
    "language": "en",
    "version": "1.0.0"
  },
  "metadata": {
    "version": "1.0.0",
    "schemaVersion": "1.0.0",
    "repositoryVersion": "1.0.0",
    "status": "Draft",
    "reviewState": "Not Reviewed",
    "createdAt": "2026-07-16T00:00:00Z",
    "updatedAt": "2026-07-16T00:00:00Z",
    "createdBy": [
      {
        "type": "Automation",
        "name": "ChatGPT",
        "role": "Evidence synthesis and seed data drafting"
      }
    ],
    "license": "Apache-2.0",
    "language": "en",
    "provenance": {
      "source": "Official Qdrant repository, release notes, and documentation",
      "generator": "ChatGPT",
      "generatorVersion": "GPT-5.6 Thinking",
      "generatedAt": "2026-07-16T00:00:00Z",
      "sourceFiles": [
        "schema/vector-database.schema.json",
        "schema/definitions/identity.schema.json",
        "schema/definitions/metadata.schema.json",
        "schema/definitions/description.schema.json",
        "schema/definitions/claim.schema.json",
        "schema/definitions/evidence.schema.json",
        "schema/definitions/reference.schema.json"
      ]
    }
  },
  "description": {
    "summary": "Qdrant is an open-source dedicated vector database and search engine for storing, filtering, and retrieving dense, sparse, named, and multi-vector representations.",
    "description": "Qdrant provides exact and HNSW-based vector search, structured payload filtering, dense-sparse hybrid retrieval, multi-stage queries, disk-backed storage options, quantization, and distributed sharding and replication. It is available for self-hosted deployments and as Qdrant Cloud. This record separates documented engine capabilities from configuration-, workload-, and deployment-dependent guarantees."
  },
  "vectorDatabase": {
    "databaseType": "Dedicated Vector Database",
    "deploymentModels": [
      "Self Hosted",
      "Managed Cloud",
      "Local"
    ],
    "supportedIndexTypes": [
      "Flat",
      "HNSW",
      "Scalar Quantization",
      "Product Quantization",
      "Hybrid Sparse Dense",
      "Other"
    ],
    "distanceMetrics": [
      "Cosine Similarity",
      "Dot Product",
      "Euclidean Distance",
      "Manhattan Distance"
    ],
    "metadataFiltering": {
      "supported": true,
      "filterTypes": [
        "Exact Match",
        "Range",
        "Boolean",
        "Full Text",
        "Geo Spatial",
        "Nested Fields",
        "Array Contains"
      ],
      "preFilterSupported": true
    },
    "hybridSearch": {
      "supported": true,
      "methods": [
        "Sparse Dense Fusion",
        "Reciprocal Rank Fusion",
        "Weighted Score Fusion",
        "Other"
      ],
      "scoreNormalizationSupported": true
    },
    "scalability": {
      "horizontalScaling": "High",
      "verticalScaling": "High",
      "shardingSupported": true,
      "replicationSupported": true,
      "diskBackedIndexingSupported": true
    },
    "consistency": {
      "consistencyModel": "Configurable",
      "upsertsSupported": true,
      "deletesSupported": true,
      "transactionSupport": "Limited"
    },
    "integration": {
      "apis": [
        "REST",
        "gRPC",
        "Native SDK"
      ],
      "sdkLanguages": [
        "Python",
        "Java",
        "JavaScript",
        "TypeScript",
        "Go",
        "Rust",
        "C#"
      ]
    },
    "ragUsage": {
      "recommendedStages": [
        "Indexing",
        "Retrieval",
        "Reranking",
        "Monitoring"
      ],
      "retrievalPatterns": [
        "Top K Similarity Search",
        "Filtered Retrieval",
        "Hybrid Retrieval",
        "Multi Vector Retrieval",
        "Long Term Memory"
      ],
      "indexingConsiderations": [
        "Create payload indexes for fields used by production filters, preferably before ingesting data, so filtered HNSW construction can account for those fields.",
        "Choose exact search, HNSW parameters, on-disk storage, and quantization only after measuring recall, latency, memory, and ingestion behavior on representative data.",
        "Size shards and replicas for the expected cluster topology; self-hosted clusters require explicit planning for shard placement, movement, and rebalancing.",
        "Treat named dense, sparse, and multi-vector spaces as separate retrieval representations with explicit dimensions, metrics, and lifecycle management."
      ],
      "retrievalConsiderations": [
        "Use payload filters together with appropriate payload indexes and test strict or combined filters against the chosen HNSW search configuration.",
        "Tune dense-sparse fusion with a relevance evaluation set; RRF, weighted RRF, and distribution-based score fusion make different ranking assumptions.",
        "Place fusion at the top-level query when a distributed collection requires results to be fused globally across shards.",
        "Set read consistency, write consistency, and ordering options according to the required tradeoff among latency, availability, and concurrent-update consistency."
      ]
    },
    "limitations": [
      "HNSW, on-disk indexing, and quantization introduce workload-specific tradeoffs among recall, latency, memory, storage, and indexing cost.",
      "Strict or compound filters can reduce HNSW graph connectivity; payload-index design and search-method tuning remain necessary.",
      "A self-hosted distributed deployment does not automatically rebalance existing shards when nodes are added or removed.",
      "High availability requires replication and an appropriate number of voting nodes; a two-node cluster cannot retain a Raft majority when one node is unavailable.",
      "Concurrent updates can diverge across replicas under default settings unless stronger read consistency, write consistency, or update ordering is selected.",
      "Qdrant does not provide general multi-record ACID transactions comparable to a relational database; update durability and ordering guarantees are scoped to its point, WAL, shard, and cluster mechanisms."
    ],
    "usageGuidance": [
      "Record the Qdrant server and client versions because API behavior, storage migrations, and supported query features change across releases.",
      "Build a representative relevance evaluation set before choosing HNSW, quantization, fusion, or multistage-query parameters.",
      "Create snapshots and test restoration procedures even when replication is enabled.",
      "Use payload indexes selectively for fields that participate in filters, faceting, ordering, or tenant partitioning.",
      "Upgrade self-hosted clusters through supported intermediate versions when release notes document storage-format or migration constraints."
    ]
  },
  "references": [
    {
      "id": "REFERENCE-21001",
      "title": "Qdrant v1.18.2 Release",
      "authors": [
        {
          "name": "Qdrant maintainers"
        }
      ],
      "sourceType": "Repository",
      "sourcePriority": "Primary",
      "publishedAt": "2026-06-04",
      "canonicalUrl": "https://github.com/qdrant/qdrant/releases/tag/v1.18.2",
      "repository": "https://github.com/qdrant/qdrant",
      "version": "1.18.2",
      "accessedAt": "2026-07-16"
    },
    {
      "id": "REFERENCE-21002",
      "title": "Qdrant Documentation: Overview",
      "authors": [
        {
          "name": "Qdrant"
        }
      ],
      "sourceType": "Official Documentation",
      "sourcePriority": "Primary",
      "canonicalUrl": "https://qdrant.tech/documentation/overview/",
      "accessedAt": "2026-07-16"
    },
    {
      "id": "REFERENCE-21003",
      "title": "Qdrant Documentation: Vectors",
      "authors": [
        {
          "name": "Qdrant"
        }
      ],
      "sourceType": "Official Documentation",
      "sourcePriority": "Primary",
      "canonicalUrl": "https://qdrant.tech/documentation/manage-data/vectors/",
      "accessedAt": "2026-07-16"
    },
    {
      "id": "REFERENCE-21004",
      "title": "Qdrant Documentation: Indexing",
      "authors": [
        {
          "name": "Qdrant"
        }
      ],
      "sourceType": "Official Documentation",
      "sourcePriority": "Primary",
      "canonicalUrl": "https://qdrant.tech/documentation/manage-data/indexing/",
      "accessedAt": "2026-07-16"
    },
    {
      "id": "REFERENCE-21005",
      "title": "Qdrant Documentation: Filtering",
      "authors": [
        {
          "name": "Qdrant"
        }
      ],
      "sourceType": "Official Documentation",
      "sourcePriority": "Primary",
      "canonicalUrl": "https://qdrant.tech/documentation/search/filtering/",
      "accessedAt": "2026-07-16"
    },
    {
      "id": "REFERENCE-21006",
      "title": "Qdrant Documentation: Hybrid and Multi-Stage Queries",
      "authors": [
        {
          "name": "Qdrant"
        }
      ],
      "sourceType": "Official Documentation",
      "sourcePriority": "Primary",
      "canonicalUrl": "https://qdrant.tech/documentation/search/hybrid-queries/",
      "accessedAt": "2026-07-16"
    },
    {
      "id": "REFERENCE-21007",
      "title": "Qdrant Documentation: Distributed Deployment",
      "authors": [
        {
          "name": "Qdrant"
        }
      ],